{"composition_version":"release-composition/v1","conflict_policy":"error","created_at":"2026-08-24T23:30:37.664131Z","fallback_policy":"none","label":"pt-PT Speech · real-data audit · provider_only/forced_leaf","language":"pt","layers":{"example_selection":{"artifact_id":"sha256:561ca9e3141624bde18985ee2ca5bb9fe071cc2da293bd5da13b109e9f0369cb","record_count":600,"requires":{"inventory":"sha256:c9f75a7111d48e5eba899b63a9e8f30375f9e181f12093b9723b9a14fbdca77e","sentences":"sha256:4d14eba75650810cfa4272bcf94ccae27d93e0a833e735b9bc5f479369f4733c"},"selection_version":"layer-selection/v1","source_id":"20260824T230907Z-f6fceb5d","source_type":"run"},"inventory":{"artifact_id":"sha256:c9f75a7111d48e5eba899b63a9e8f30375f9e181f12093b9723b9a14fbdca77e","record_count":200,"requires":{},"selection_version":"layer-selection/v1","source_id":"20260824T230907Z-f6fceb5d","source_type":"run"},"sense_menu":{"artifact_id":"sha256:dd3116767ea92d238dc349177983f8a2d326f74bc8d38375e54c5b0b42075ea9","record_count":200,"requires":{"inventory":"sha256:c9f75a7111d48e5eba899b63a9e8f30375f9e181f12093b9723b9a14fbdca77e"},"selection_version":"layer-selection/v1","source_id":"20260824T230907Z-f6fceb5d","source_type":"run"},"sentences":{"artifact_id":"sha256:4d14eba75650810cfa4272bcf94ccae27d93e0a833e735b9bc5f479369f4733c","record_count":10909,"requires":{"inventory":"sha256:c9f75a7111d48e5eba899b63a9e8f30375f9e181f12093b9723b9a14fbdca77e"},"selection_version":"layer-selection/v1","source_id":"20260824T230907Z-f6fceb5d","source_type":"run"}},"locale":"pt-PT","mode":"speech","omitted_layers":[{"layer":"wsd_assignments","reason":"not_connected_examples_explicitly_unassigned"},{"layer":"manual_overrides","reason":"not_applied"},{"layer":"conjugations","reason":"not_selected"}],"progress_namespace":"pt-speech-next","publication_status":"inactive_audit","release_id":"pt-speech-v7-dual-20260825"}
