{"composition_version":"release-composition/v1","conflict_policy":"error","created_at":"2026-09-07T01:30:32.412041Z","fallback_policy":"none","label":"cs-CZ Speech · real-data audit · provider_only/forced_leaf","language":"cs","layers":{"example_selection":{"artifact_id":"sha256:8ccc9beaf6b7eee48122a971233acd0f851c6a0c781f5d73d2e4829d9e58b8a4","record_count":11000,"requires":{"inventory":"sha256:4812d85a56f6b71e2569fcc2f145aadae7439e21c02d7419f663f3ec9ae00101","sentences":"sha256:3a421cdacf099ef2a94018cd0a99190dfee3a3a498059c1a6d6b6e22cacad970"},"selection_version":"layer-selection/v1","source_id":"20260906T233350Z-c0325bb1","source_type":"run"},"inventory":{"artifact_id":"sha256:4812d85a56f6b71e2569fcc2f145aadae7439e21c02d7419f663f3ec9ae00101","record_count":3000,"requires":{},"selection_version":"layer-selection/v1","source_id":"20260906T233350Z-c0325bb1","source_type":"run"},"sense_menu":{"artifact_id":"sha256:61438fb407471c7106b23742d6da878ae9f7f7fe80cee4fc6ed3025f89eeeb2e","record_count":3000,"requires":{"inventory":"sha256:4812d85a56f6b71e2569fcc2f145aadae7439e21c02d7419f663f3ec9ae00101"},"selection_version":"layer-selection/v1","source_id":"20260906T233350Z-c0325bb1","source_type":"run"},"sentences":{"artifact_id":"sha256:3a421cdacf099ef2a94018cd0a99190dfee3a3a498059c1a6d6b6e22cacad970","record_count":169923,"requires":{"inventory":"sha256:4812d85a56f6b71e2569fcc2f145aadae7439e21c02d7419f663f3ec9ae00101"},"selection_version":"layer-selection/v1","source_id":"20260906T233350Z-c0325bb1","source_type":"run"},"wsd_assignments":{"artifact_id":"sha256:d04d31be9eb0054e186da82ac45888ce8767d967df342198a948725288f5cdc4","parameters":{"publication_projection":"forced_leaf","selection_projection":"provider_only"},"record_count":20910,"requires":{"sense_menu":"sha256:61438fb407471c7106b23742d6da878ae9f7f7fe80cee4fc6ed3025f89eeeb2e","sentences":"sha256:3a421cdacf099ef2a94018cd0a99190dfee3a3a498059c1a6d6b6e22cacad970"},"selection_version":"layer-selection/v1","source_id":"20260906T233350Z-c0325bb1","source_type":"run"}},"locale":"cs-CZ","mode":"speech","omitted_layers":[{"layer":"manual_overrides","reason":"not_applied"},{"layer":"conjugations","reason":"not_selected"}],"progress_namespace":"cs-speech-next","publication_status":"inactive_audit","release_id":"cs-speech-3000-tiered-20260907"}
