{"composition_version":"release-composition/v1","conflict_policy":"error","created_at":"2026-08-24T23:31:30.226448Z","fallback_policy":"none","label":"fr-FR Speech · real-data audit · provider_only/forced_leaf","language":"fr","layers":{"example_selection":{"artifact_id":"sha256:4e261011b9857e5869c04a2f7404ef907b2d9c923dff9c5b1bd6dde4ab1e9170","record_count":600,"requires":{"inventory":"sha256:1766feb93087844ca4544e8f657c7dae95212b76435daa095539d52862de3b7a","sentences":"sha256:0fac553a6639d7d5427ca011b0805172b16a16710665bf42ee33102e314053fd"},"selection_version":"layer-selection/v1","source_id":"20260822T172017Z-651bcd8e","source_type":"run"},"inventory":{"artifact_id":"sha256:1766feb93087844ca4544e8f657c7dae95212b76435daa095539d52862de3b7a","record_count":200,"requires":{},"selection_version":"layer-selection/v1","source_id":"20260822T172017Z-651bcd8e","source_type":"run"},"sense_menu":{"artifact_id":"sha256:5028517497ec857050740c415299494f0b42a0ba460cf0b49fed1ff63f86fc37","record_count":200,"requires":{"inventory":"sha256:1766feb93087844ca4544e8f657c7dae95212b76435daa095539d52862de3b7a"},"selection_version":"layer-selection/v1","source_id":"20260822T172017Z-651bcd8e","source_type":"run"},"sentences":{"artifact_id":"sha256:0fac553a6639d7d5427ca011b0805172b16a16710665bf42ee33102e314053fd","record_count":7671,"requires":{"inventory":"sha256:1766feb93087844ca4544e8f657c7dae95212b76435daa095539d52862de3b7a"},"selection_version":"layer-selection/v1","source_id":"20260822T172017Z-651bcd8e","source_type":"run"}},"locale":"fr-FR","mode":"speech","omitted_layers":[{"layer":"wsd_assignments","reason":"not_connected_examples_explicitly_unassigned"},{"layer":"manual_overrides","reason":"not_applied"},{"layer":"conjugations","reason":"not_selected"}],"progress_namespace":"fr-speech-next","publication_status":"inactive_audit","release_id":"fr-speech-v7-dual-20260825"}
