{"composition_version":"release-composition/v1","conflict_policy":"error","created_at":"2026-09-01T05:46:07.908508Z","fallback_policy":"none","label":"pt-PT Speech · real-data audit · provider_only/forced_leaf","language":"pt","layers":{"example_selection":{"artifact_id":"sha256:3755a0fbe59290a3871965849ab2340acdfddc5f93e117737918d719ca883269","record_count":6000,"requires":{"inventory":"sha256:5779aeb110e51fbd4c0368c4654a4b078fa47f1347dbfbd85250744f4c08e65b","sentences":"sha256:dde117dfbb7903c0d0eaaf7b76c2c6aca7f909733f02919bb207a35241d9c502"},"selection_version":"layer-selection/v1","source_id":"20260831T222156Z-28bcf147","source_type":"run"},"inventory":{"artifact_id":"sha256:5779aeb110e51fbd4c0368c4654a4b078fa47f1347dbfbd85250744f4c08e65b","record_count":2000,"requires":{},"selection_version":"layer-selection/v1","source_id":"20260831T222156Z-28bcf147","source_type":"run"},"sense_menu":{"artifact_id":"sha256:c091c2506310a9c8dd789fa9709a6066b79c66b7e8f1b9a8892c166cf3476a91","record_count":2000,"requires":{"inventory":"sha256:5779aeb110e51fbd4c0368c4654a4b078fa47f1347dbfbd85250744f4c08e65b"},"selection_version":"layer-selection/v1","source_id":"20260831T222156Z-28bcf147","source_type":"run"},"sentences":{"artifact_id":"sha256:dde117dfbb7903c0d0eaaf7b76c2c6aca7f909733f02919bb207a35241d9c502","record_count":117863,"requires":{"inventory":"sha256:5779aeb110e51fbd4c0368c4654a4b078fa47f1347dbfbd85250744f4c08e65b"},"selection_version":"layer-selection/v1","source_id":"20260831T222156Z-28bcf147","source_type":"run"},"wsd_assignments":{"artifact_id":"sha256:021033c139f1022beb817708539a973a21fab9ec9c8c4145e8dbda93c654bf61","parameters":{"publication_projection":"forced_leaf","selection_projection":"provider_only"},"record_count":19360,"requires":{"sense_menu":"sha256:c091c2506310a9c8dd789fa9709a6066b79c66b7e8f1b9a8892c166cf3476a91","sentences":"sha256:dde117dfbb7903c0d0eaaf7b76c2c6aca7f909733f02919bb207a35241d9c502"},"selection_version":"layer-selection/v1","source_id":"20260831T222156Z-28bcf147","source_type":"run"}},"locale":"pt-PT","mode":"speech","omitted_layers":[{"layer":"manual_overrides","reason":"not_applied"},{"layer":"conjugations","reason":"not_selected"}],"progress_namespace":"pt-speech-next","publication_status":"inactive_audit","release_id":"pt-speech-european-2000-v7-20260901"}
