{"composition_version":"release-composition/v1","conflict_policy":"error","created_at":"2026-09-08T07:52:39.971549Z","fallback_policy":"none","label":"cs-CZ Speech · real-data audit · provider_only/forced_leaf","language":"cs","layers":{"example_selection":{"artifact_id":"sha256:cbcb2333aee662fb6c56acfc4cc805ceec639c89e29c772b4cd21c4e6ea04255","record_count":11000,"requires":{"inventory":"sha256:4812d85a56f6b71e2569fcc2f145aadae7439e21c02d7419f663f3ec9ae00101","sentences":"sha256:c66255a32576062a8d77a79b0afae7cb660d77e15b35f4e8366e716908d24a50"},"selection_version":"layer-selection/v1","source_id":"20260908T071855Z-140dba96","source_type":"run"},"inventory":{"artifact_id":"sha256:4812d85a56f6b71e2569fcc2f145aadae7439e21c02d7419f663f3ec9ae00101","record_count":3000,"requires":{},"selection_version":"layer-selection/v1","source_id":"20260908T071855Z-140dba96","source_type":"run"},"sense_menu":{"artifact_id":"sha256:e06e81411a25ffbd62a1177f78b446307e3f73b5ca7c18d53d49e1077e4ed764","record_count":3000,"requires":{"inventory":"sha256:4812d85a56f6b71e2569fcc2f145aadae7439e21c02d7419f663f3ec9ae00101"},"selection_version":"layer-selection/v1","source_id":"20260908T071855Z-140dba96","source_type":"run"},"sentences":{"artifact_id":"sha256:c66255a32576062a8d77a79b0afae7cb660d77e15b35f4e8366e716908d24a50","record_count":123234,"requires":{"inventory":"sha256:4812d85a56f6b71e2569fcc2f145aadae7439e21c02d7419f663f3ec9ae00101"},"selection_version":"layer-selection/v1","source_id":"20260908T071855Z-140dba96","source_type":"run"},"wsd_assignments":{"artifact_id":"sha256:7ff359daf17c0f9cd3537714e30684af8032f23d1e48c4e2f93f6a897182de83","parameters":{"publication_projection":"forced_leaf","selection_projection":"provider_only"},"record_count":20894,"requires":{"sense_menu":"sha256:e06e81411a25ffbd62a1177f78b446307e3f73b5ca7c18d53d49e1077e4ed764","sentences":"sha256:c66255a32576062a8d77a79b0afae7cb660d77e15b35f4e8366e716908d24a50"},"selection_version":"layer-selection/v1","source_id":"20260908T071855Z-140dba96","source_type":"run"}},"locale":"cs-CZ","mode":"speech","omitted_layers":[{"layer":"manual_overrides","reason":"not_applied"},{"layer":"conjugations","reason":"not_selected"}],"progress_namespace":"cs-speech-next","publication_status":"inactive_audit","release_id":"cs-speech-3000-onesentence-20260908"}
