{"composition_version":"release-composition/v1","conflict_policy":"error","created_at":"2026-09-08T07:32:30.405102Z","fallback_policy":"none","label":"pt-PT Speech · real-data audit · provider_only/forced_leaf","language":"pt","layers":{"example_selection":{"artifact_id":"sha256:79db6ec653e502fcd51408193248eef1bc9d73f4dccca12755965a80a3842bc9","record_count":11000,"requires":{"inventory":"sha256:a99f2cf06d63e7469b231a8b16ef6509593d6c0b51dac0eb06b484ee9bf181f6","sentences":"sha256:d3f52ba1130c8ec29f04ac13ff677b6556451a12bbcd0165dbe8025a87c54b23"},"selection_version":"layer-selection/v1","source_id":"20260907T193206Z-c87fbcdb","source_type":"run"},"inventory":{"artifact_id":"sha256:a99f2cf06d63e7469b231a8b16ef6509593d6c0b51dac0eb06b484ee9bf181f6","record_count":3000,"requires":{},"selection_version":"layer-selection/v1","source_id":"20260907T193206Z-c87fbcdb","source_type":"run"},"sense_menu":{"artifact_id":"sha256:237137304bcd1bebf24206d54bb516a475f7dc7406c02d82e876d1382ce90b74","record_count":3000,"requires":{"inventory":"sha256:a99f2cf06d63e7469b231a8b16ef6509593d6c0b51dac0eb06b484ee9bf181f6"},"selection_version":"layer-selection/v1","source_id":"20260907T193206Z-c87fbcdb","source_type":"run"},"sentences":{"artifact_id":"sha256:d3f52ba1130c8ec29f04ac13ff677b6556451a12bbcd0165dbe8025a87c54b23","record_count":176535,"requires":{"inventory":"sha256:a99f2cf06d63e7469b231a8b16ef6509593d6c0b51dac0eb06b484ee9bf181f6"},"selection_version":"layer-selection/v1","source_id":"20260907T193206Z-c87fbcdb","source_type":"run"},"wsd_assignments":{"artifact_id":"sha256:d67429f6cb43cbe1ad510cfbd242b3283caf32c3f673bd0e5f42af9ff8ee9876","parameters":{"publication_projection":"forced_leaf","selection_projection":"provider_only"},"record_count":28825,"requires":{"sense_menu":"sha256:237137304bcd1bebf24206d54bb516a475f7dc7406c02d82e876d1382ce90b74","sentences":"sha256:d3f52ba1130c8ec29f04ac13ff677b6556451a12bbcd0165dbe8025a87c54b23"},"selection_version":"layer-selection/v1","source_id":"20260907T193206Z-c87fbcdb","source_type":"run"}},"locale":"pt-PT","mode":"speech","omitted_layers":[{"layer":"manual_overrides","reason":"not_applied"},{"layer":"conjugations","reason":"not_selected"}],"progress_namespace":"pt-speech-next","publication_status":"inactive_audit","release_id":"pt-speech-european-3000-onesentence-20260908b"}
