{"composition_version":"release-composition/v1","conflict_policy":"error","created_at":"2026-08-24T23:30:12.014812Z","fallback_policy":"none","label":"es-ES Speech · real-data audit · provider_only/forced_leaf","language":"es","layers":{"example_selection":{"artifact_id":"sha256:ed572ccb97c99e6f3478d005b849621472209b5b42844114272ba36fba8bd76c","record_count":5997,"requires":{"inventory":"sha256:13a83dbbc5799f35a7304fd5cf44d5f94e4c027181de048c5472d19464037d6b","sentences":"sha256:771e203b0b42ad1360f78aafb0aed97b03c890752cd5ccbaf605ea7da0de5d4c"},"selection_version":"layer-selection/v1","source_id":"20260823T215525Z-5836dcc4","source_type":"run"},"inventory":{"artifact_id":"sha256:13a83dbbc5799f35a7304fd5cf44d5f94e4c027181de048c5472d19464037d6b","record_count":2000,"requires":{},"selection_version":"layer-selection/v1","source_id":"20260823T215525Z-5836dcc4","source_type":"run"},"sense_menu":{"artifact_id":"sha256:f70cacc80ed96c87b1093fdd548cef2adc591ccc9ec310c39be7745a036535c6","record_count":2000,"requires":{"inventory":"sha256:13a83dbbc5799f35a7304fd5cf44d5f94e4c027181de048c5472d19464037d6b"},"selection_version":"layer-selection/v1","source_id":"20260823T215525Z-5836dcc4","source_type":"run"},"sentences":{"artifact_id":"sha256:771e203b0b42ad1360f78aafb0aed97b03c890752cd5ccbaf605ea7da0de5d4c","record_count":35842,"requires":{"inventory":"sha256:13a83dbbc5799f35a7304fd5cf44d5f94e4c027181de048c5472d19464037d6b"},"selection_version":"layer-selection/v1","source_id":"20260823T215525Z-5836dcc4","source_type":"run"},"source_titles":{"artifact_id":"sha256:73e2e2010933606e34aa0d7813560eb56a9bb2571cfeef0e022ff1940d75af2e","record_count":2687,"requires":{"sentences":"sha256:771e203b0b42ad1360f78aafb0aed97b03c890752cd5ccbaf605ea7da0de5d4c"},"selection_version":"layer-selection/v1","source_id":"imdb-retrieved-2026-08-22","source_type":"snapshot"},"wsd_assignments":{"artifact_id":"sha256:857b7f3ea45e484e8c7e3f9843056f3257b976077e92558be890a407e4bf1d43","parameters":{"publication_projection":"forced_leaf","selection_projection":"provider_only"},"record_count":5962,"requires":{"sense_menu":"sha256:f70cacc80ed96c87b1093fdd548cef2adc591ccc9ec310c39be7745a036535c6","sentences":"sha256:771e203b0b42ad1360f78aafb0aed97b03c890752cd5ccbaf605ea7da0de5d4c"},"selection_version":"layer-selection/v1","source_id":"20260823T215525Z-5836dcc4","source_type":"run"}},"locale":"es-ES","mode":"speech","omitted_layers":[{"layer":"manual_overrides","reason":"not_applied"},{"layer":"conjugations","reason":"not_selected"}],"progress_namespace":"es-speech-next","publication_status":"inactive_audit","release_id":"es-speech-v7-dual-20260825"}
